,Category,Title
0,0,Google Cloud Program Manager
1,1,"Supplier Development Engineer (SDE), Cable/Connector"
2,2,"Data Analyst, Product and Tools Operations, Google Technical Services"
3,3,"Developer Advocate, Partner Engineering"
4,0,"Program Manager, Audio Visual (AV) Deployments"
5,2,"Associate Account Strategist (Czech/Slovak), Global Customer Experience"
6,4,"Supplier Development Engineer, Camera, Consumer Hardware"
7,5,"Strategic Technology Partner Manager, Healthcare and Life Sciences"
8,1,"Manufacturing Business Manager, Google Hardware"
9,2,"Solutions Architect, Healthcare and Life Sciences, Google Cloud"
10,6,"Data Analyst, Consumer Hardware"
11,5,Partner Onboarding Manager (Americas)
12,2,"Associate Account Strategist (Ukrainian), GMS Sales"
13,6,"Survey Lead, Google Cloud Support"
14,2,"Solution Architect, Google Cloud Platform (Apigee)"
15,4,Manufacturing Test Engineer
16,2,"Machine Learning Product Specialist, Google Cloud (EMEA)"
17,7,"Software Engineering Manager, Cloud Storage, Site Reliability Engineering"
18,4,"Global Supply Chain Manager, Display/Touch, Consumer Hardware"
19,0,"Technical Program Manager, ASIC Development"
20,6,"Quantitative Analyst, Ads Quality"
21,7,"Software Engineer Manager, Tools and Infrastructure"
22,0,Head of Professional Services
23,6,"Survey Lead, Google Cloud Support"
24,0,"Technical Trainer Manager, Google Cloud"
25,2,"Partner Sales Engineer, Google Cloud"
26,2,"Technical Solutions Engineer, Chrome and Android, Google Cloud"
27,8,"Program Manager, Supply Chain Data Management"
28,2,"Machine Learning Product Specialist, Google Cloud (EMEA)"
29,2,"Head of Partner Engineering, Google Cloud"
30,0,"Presales Manager, New Business Development"
31,2,"Technical Solutions Consultant, Google Technical Services (English, German)"
32,6,"Solutions Consultant, Ads, Google Professional Services"
33,9,"Chief of Staff, Google Hardware"
34,2,"Measurement Solutions Consultant, Google Technical Services"
35,2,"Big Data Product Specialist, Google Cloud (English)"
36,1,"Global Supply Chain Manager, Cable and Connector, Consumer Hardware"
37,2,Technical Contracts Manager
38,0,"High Performance Computing (HPC) Specialist, Google Cloud"
39,0,"Technical Program Manager, Google Cloud Functions"
40,7,Software Engineer
41,2,"Solutions Architect, Healthcare and Life Sciences, Google Cloud"
42,0,"Program Manager, Operations, Google Cloud Web"
43,0,"High Performance Computing (HPC) Specialist, Google Cloud"
44,2,"Vendor Operations Specialist (EMEA), Google Technical Services Consumers"
45,2,"Solution Architect, Google Cloud Platform (Apigee)"
46,7,"Graphics Software Engineer, Robotics Simulation, Google Cloud Platform"
47,10,"Technical Writer, University Graduate"
48,2,"Solutions Architect, Healthcare and Life Sciences, Google Cloud"
49,11,"Technical Program Manager, Cloud Infrastructure Planning and Resource Management"
50,2,Measurement and Attribution Specialist (Northern Europe)
51,0,Global Partner Business Development Manager
52,0,"Technical Program Manager, Corporate Engineering"
53,2,"Solutions Engineer, Google Cloud Healthcare and Life Sciences"
54,2,"Technical Specialist, Google Technical Services, Ads"
55,2,"Strategic Cloud Engineer, Google Cloud Professional Services"
56,5,Partner Onboarding Manager (Americas)
57,2,"Security Product Specialist, Google Cloud Platform"
58,2,"Media and Entertainment Specialist, Google Cloud"
59,1,"Product Operations Program Manager, Consumer Hardware"
60,2,"Media and Entertainment Specialist, Google Cloud"
61,0,"Community Enablement Manager, Global Partner, Google Cloud"
62,0,"Cloud Consultant, Professional Services, Google Cloud"
63,2,"Strategic Cloud Engineer, Google Professional Services"
64,4,"Engineering Manager, Consumer Hardware"
65,7,"Software Engineer, Performance Modeling"
66,2,"Associate Account Strategist (Hungarian), Global Customer Experience"
67,2,"Partner Sales Engineer, Google Cloud"
68,2,"Technical Specialist, Google Technical Services (English and Italian)"
69,2,"Technical Account Manager, Google Technical Services (Mandarin or Cantonese)"
70,2,"Manager, Measurement & Attribution Specialists, Google Technical Professional Services"
71,6,"Solutions Consultant, Ads, Google Professional Services"
72,7,"Software Engineer, Android Applications, Verily Life Sciences - Cambridge"
73,0,Global Partner Business Development Manager
74,0,"Technical Enablement Manager, Global Partner, Google Cloud"
75,3,"Developer Advocate, Cloud Platform"
76,2,"Technical Solutions Consultant, Google Technical Services"
77,7,Front End Software Engineer
78,2,"G Suite Strategic Cloud Engineer, Google Professional Services"
79,2,"Technical Solutions Consultant, Android"
80,7,"Software Engineer, Image Processing, Consumer Hardware"
81,4,Analog & CAD Automation Engineer
82,0,"Program Manager, Mergers and Acquisitions, Corporate Engineering"
83,6,"Partner Sales Engineer Manager, Google Cloud"
84,7,"Cloud Integration Software Engineer, Robotics Simulation, Google Cloud Platform"
85,6,"Quantitative Analyst Lead, Trust and Safety"
86,2,"Partner Sales Engineer, Google Cloud"
87,0,"Business Lead for Partner Relationship Management (PRM) Solution, Google Cloud"
88,10,"Technical Writer, University Graduate"
89,4,FPGA Design/Prototyping Engineer
90,0,"Training Partners Business Manager, Americas, Google Cloud"
91,4,"Analog / Mixed Signal IC Design Engineer, Verily Life Sciences - South San Francisco"
92,6,"Product Specialist, Google Cloud"
93,4,ASIC Physical Design Engineering Tech Lead & Manager
94,2,"Partner Sales Engineer, Google Cloud"
95,0,Global Partner Business Development Manager
96,0,"Technical Program Manager, Enterprise Communications"
97,0,"Program Manager, Behavioral Health, Verily Life Sciences - South San Francisco"
98,7,"Software Engineer, Android Applications, Verily Life Sciences - South San Francisco"
99,1,"Global Supply Chain and Sourcing Manager, CPUs, Consumer Hardware"
100,7,ソフトウェア エンジニア、Chrome OS ビデオ
101,0,"Onsite Training Programs Lead, Google Cloud"
102,0,Customer Success Manager
103,4,Cell Design and Process Engineer
104,2,"Technical Solutions Consultant, Google Technical Services (English, German)"
105,0,"Cloud Consultant, Professional Services, Google Cloud"
106,1,"Global Supply Chain Manager, Audio, Consumer Hardware"
107,6,"Process Specialist, Curated Formats, Google Technical Services"
108,7,"Software Engineer, Virtual Prototyping"
109,4,"Hardware System Engineer, System on a Chip"
110,4,"Supplier Development Engineer, Sensor Module"
111,11,"Systems Administrator, Windows"
112,2,"Technical Solutions Engineer, G Suite, Google Cloud"
113,0,"Program Manager, Geo Data Operations"
114,1,"Global Supply Chain Manager, Keyboard and Trackpad, Consumer Hardware"
115,2,"Solution Architect, Google Cloud Platform (Apigee)"
116,0,"Technical Trainer Manager, Google Cloud"
117,0,"Product Strategy and Operations Lead, Consumer Payments (English, Russian)"
118,2,"Security Product Specialist, Google Cloud Platform"
119,2,"Partner Technology Manager, Product and Tool Operations, Google Technical Services"
120,2,"Partner Sales Engineer, Google Cloud"
121,2,Programmatic Account Strategist (English)
122,2,"Technical Solutions Consultant, Google Technical Services"
123,4,"Manufacturing Engineer, Verily Life Sciences - South San Francisco"
124,2,"Big Data Product Specialist, Google Cloud (English)"
125,0,Vendor Operations Program Manager
126,10,"Technical Writer, University Graduate"
127,4,Silicon Design Monitoring Engineer
128,2,Advertising Operations Associate (Korean)
129,2,"Technical Solutions Engineer, Firebase, Google Cloud"
130,2,"Technical Solutions Engineering Manager, Firebase, Google Cloud"
131,11,"Software Engineer, Site Reliability Engineering"
132,11,Software Asset Management Vendor Manager
133,0,"Manager, Performance Specialists"
134,12,"Linguist, Natural Language Understanding, Machine Intelligence"
135,0,"Operations Lead, Google Play"
136,0,"Presales Manager, New Business Development"
137,4,"New Product Quality Manager, Consumer Hardware"
138,2,"Pre-Sales Solutions Architect, Google Cloud"
139,1,"Global Supply Chain Manager, Power, Consumer Hardware"
140,2,"Technical Solutions Consultant, Android TV, Android Partner Engineering"
141,0,"Technical Program Manager, Fiber Network Data"
142,3,"Developer Advocate, Partner Engineering"
143,4,"Systems Architect Hardware Engineer, Home"
144,0,"Technical Program Manager, Network Business Operations"
145,3,"Developer Advocate, Web"
146,1,"Global Sourcing and Supply Manager, Camera, Consumer Hardware"
147,2,"Partner Engineer, Google Assistant, Google Technical Services"
148,4,"Supplier Development Engineer, Sensor Module"
149,7,"Application Engineer, Legal"
150,4,"IC Test Engineer, Verily Life Sciences - South San Francisco"
151,12,"Corporate Operations Engineer, IT Support, EPM"
152,2,"G Suite Strategic Cloud Engineer, Google Professional Services"
153,13,"Communications and Programs Manager, Google Technical Services"
154,2,"Android Partner Engineer, Technical Solutions Consultant"
155,5,"Partner Strategy Planning Lead, Google Cloud"
156,7,Software Engineering Manager
157,0,"Community Enablement Manager, Global Partner, Google Cloud"
158,5,"Partner Operations Manager, Commerce, Google Technical Services"
159,9,"Product Strategist, Growth, YouTube"
160,7,"Software Engineer, Verily Life Sciences - South San Francisco"
161,8,"Technical Program Manager, Data Center Design"
162,14,"Network Implementation Engineer, Corporate Network"
163,0,"Program Manager, Maps Support, Google Cloud"
164,12,"Corporate Operations Engineer, Finance IT Support"
165,2,"Technical Account Manager, Google Technical Services (Mandarin or Cantonese)"
166,7,Software Engineer (English)
167,2,"Partner Sales Engineer, Google Cloud"
168,13,"Program Manager/Producer, Global Hardware Marketing"
169,2,"Technical Solutions Consultant Manager, Android Automotive Partner Engineering"
170,2,"Manager, Measurement & Attribution Specialists, Google Technical Professional Services"
171,7,Software Engineer
172,0,"Program Manager, Geo Merchant"
173,5,"Global Technical Alliance Manager, Strategic Consultative Partnerships"
174,10,"Technical Writer, University Graduate"
175,0,"Product Operations and Strategy Lead, Engineering"
176,2,"Sales Engineer, Google Cloud Platform"
177,2,"Technical Solutions Engineering Manager, Firebase, Google Cloud"
178,0,"Technical Enablement Manager, Global Partner, Google Cloud"
179,2,"Customer Engineer, Google Cloud Platform (Portuguese and English)"
180,4,"Physical Design/Implementation Engineer, ASIC"
181,0,"Product Specialist, Hardware"
182,6,"Quantitative Analyst, Trust and Safety"
183,0,"Program Manager, Product Data Management"
184,2,"Customer Solutions Engineer, Google Technical Services Ads"
185,11,"Strategic Negotiator, Data Center"
186,2,"Technical Solutions Consultant, Google Technical Services"
187,7,"Software Engineer, Tools and Infrastructure"
188,1,"Global Supply Chain Manager, Packaging"
189,0,"Training Partners Business Manager, Americas, Google Cloud"
190,2,"Sales Engineering Manager, Google Cloud"
191,11,"Technical Program Manager, Site Reliability Engineering"
192,2,"Operations Lead, Global Support, Measurement and Attribution"
193,0,"Operations Analyst, Sales, Google Cloud"
194,2,"Migration Architect, Google Cloud"
195,11,Cloud DevOps and Infrastructure Engineer for Silicon Design
196,0,"Program Manager, Google Cloud Regulatory Market"
197,2,"G Suite Strategic Cloud Engineer, Google Professional Services"
198,11,"Systems Engineer, Site Reliability Engineering"
199,0,"Technical Program Manager, Angular"
200,11,"Mechanical Engineer, Data Center"
201,2,"Customer Experience Advocate, Google Technical Services (Multiple European Languages)"
202,7,"Firmware Engineer, Verily Life Sciences - South San Francisco"
203,2,"Partner Sales Engineer, Google Cloud"
204,4,"Display Technology Lead, Consumer Hardware"
205,15,"Strategic Cloud DevOps and Infrastructure Engineer, Google Cloud Professional Services"
206,7,"Software Test Engineer, Mobile and Web Applications, Verily Life Sciences - Mountain View"
207,0,"Merchant Network Planning and Quality Manager, Google Express"
208,0,"Technical Program Manager, Google Home Platform Software"
209,0,"Program Manager, Third Party Risk Management (3PRM)"
210,7,"iOS Application Developer, Project Baseline, Verily Life Sciences - Mountain View"
211,6,"Program Manager, Cloud Platform Sales Development, Google Cloud"
212,0,Store Operations Associate
213,7,Software Engineer (English)
214,2,"Strategic Cloud Engineer, Google Cloud Professional Services"
215,10,"Technical Writer, University Graduate"
216,0,Reverse Logistics Program Manager
217,1,"Global Supply Chain Manager, FPCB and PCB, Consumer Hardware"
218,5,Partner Onboarding Manager (Americas)
219,0,"Strategic Relationships Project Manager, Consumer Hardware"
220,1,"Global Sourcing and Supply Manager, Camera, Consumer Hardware"
221,2,"Networking Product Specialist, Google Cloud"
222,0,Mobile Apps Performance Specialist
223,0,"Program Manager, Create for Enterprise (Hardware Partnerships)"
224,14,"Network Engineer, Corporate Network"
225,13,Executive Briefing Manager
226,2,"Internet of Things (IoT) Product Specialist, Google Cloud"
227,2,"Internet of Things (IoT) Product Specialist, Google Cloud"
228,0,"Product Operations and Strategy Lead, Engineering"
229,2,"Machine Learning Product Specialist, Google Cloud (EMEA)"
230,2,"Technical Solutions Consultant, Verily Life Sciences - Mountain View"
231,2,"Security Product Specialist, Google Cloud Platform"
232,2,"Vendor Manager, Google Technical Services"
233,2,"Technical Solutions Consultant, Google Technical Services"
234,0,"Sales Analyst, Google Cloud"
235,7,Software Engineer
236,2,"Customer Solutions Engineer, Google Technical Services Ads"
237,2,"Product Lifecycle Management, Business Systems"
238,2,"Strategic Cloud Engineer, Google Cloud Professional Services"
239,0,"Chrome Customer Success Manager, Google Cloud"
240,3,"Developer Advocate, Partner Engineering"
241,0,"Technical Program Manager, Test Engineering, Verily Life Sciences - South San Francisco"
242,2,"Pre-Sales Solutions Architect Manager, Google Cloud"
243,14,"Network Operations Engineer, Corporate"
244,11,Operations Engineer
245,2,"Networking Product Specialist, Google Cloud (English)"
246,2,"G Suite Strategic Cloud Engineer, Google Professional Services"
247,7,"Web Solutions Engineer, Product and Tools Operations"
248,4,"Supplier Development Engineering Manager, Mechanical Operations"
249,2,"Technical Solutions Engineer, Chrome and Android, Google Cloud"
250,0,"Community Enablement Manager, Global Partner, Google Cloud"
251,4,"Supplier Development Engineer, Materials, Consumer Products"
252,0,"Partner Program Design Manager, Technology Partners, Google Cloud"
253,11,"Application Engineer, SAP"
254,2,"Manager, Technical Specialists, Google Technical Services"
255,7,"Software Engineering Manager, G Suite"
256,0,"Program Manager, Security Ecosystem, Google Cloud"
257,2,"Technical Solutions Engineer, Firebase, Google Cloud"
258,2,"Machine Learning Product Specialist, Google Cloud (EMEA)"
259,2,"Customer Solutions Engineer, Google Technical Services Ads"
260,0,Customer Success Manager
261,2,"Measurement Solutions Consultant (English, Japanese)"
262,14,Network Operations Engineer
263,0,"Program Manager, Alphabet Treasury, Corporate Engineering"
264,0,"Head of Professional Services (English, French)"
265,7,Video Algorithm Engineer
266,2,"Brand Specialist, Google Professional Services"
267,2,"Security Product Specialist, Google Cloud Platform"
268,7,"Web Solutions Engineer, Product and Tools Operations"
269,7,"High-level Synthesis Design Engineer, Consumer Hardware"
270,2,"Technical Specialist, Shopping, Google Professional Services (French)"
271,4,"Hardware System Validation Engineer, Consumer Hardware"
272,13,"Communications and Programs Manager, Google Technical Services"
273,1,"Manufacturing Business Manager, Google Hardware"
274,0,"Business Lead, Partner Directory, Google Cloud"
275,1,"Global Supply Chain and Sourcing Manager, Sensors, Consumer Hardware"
276,2,"G Suite Strategic Cloud Engineer, Google Professional Services"
277,0,"Customer Experience Data Scientist, Google Cloud Support"
278,2,"Strategic Cloud Engineer, Google Professional Services"
279,2,"Solutions Architect, Healthcare and Life Sciences, Google Cloud"
280,4,"Hardware Development Engineer, Home Team"
281,7,"Software Engineer, Accessibility"
282,4,Optical Testing Engineer
283,7,"Video Codec Design Engineer, Consumer Hardware"
284,2,"Associate Account Strategist (Polish), Global Customer Experience"
285,14,"Technical Solutions Consultant, Android Automotive, Android Partner Engineering"
286,7,"Software Test Engineer, Devices, Verily Life Sciences - South San Francisco"
287,2,"Solution Architect, Google Cloud Platform (Apigee)"
288,4,"Product Design Engineering Manager, Google Home"
289,0,Mobile Apps Performance Specialist
290,2,"Technical Account Manager, Google Technical Services Global Customer Care (English, Japanese)"
291,2,"Solution Architect, Google Cloud Platform (Apigee)"
292,4,"Formal Verification Engineer, Consumer Hardware"
293,0,"Business Lead, Partner to Partner Exchange, Google Cloud"
294,1,"Supply Planning Program Manager, Consumer Hardware"
295,0,"Technical Enablement Manager, Global Partner, Google Cloud"
296,1,Sustaining Manufacturing Process Engineer
297,0,JAPAC Partner Onboarding Manager
298,2,"Specialist, Google Analytics Solutions"
299,2,"Machine Learning Product Specialist, Google Cloud (EMEA)"
300,6,"Delivery Manager, Optimization Support, EMEA"
301,5,"Android Platform Partnerships Lead, Android and Play Business"
302,15,"Enablement Lead, Global Consulting Partnerships, Google Cloud"
303,15,"Mobile UX Lead, Large Customer Sales (English, Mandarin)"
304,6,"Data Analyst, Consumer Hardware"
305,5,Partner Onboarding Manager (Americas)
306,15,"Manager, Large Customer Sales (Spanish)"
307,5,"Strategic Partner Development Manager, Retail (English, German)"
308,6,"Survey Lead, Google Cloud Support"
309,15,"Performance Video Agency Specialist, YouTube"
310,15,"Platform Sales Manager, Media Platforms Account Lead"
311,15,"Sales Development Manager, Cross-Vertical Team"
312,15,Online Sales Account Manager (Turkish)
313,15,"Field Sales Representative, Google Cloud (DACH)"
314,15,Programmatic Account Manager
315,15,"Field Sales Representative, Google Cloud"
316,6,"Quantitative Analyst, Ads Quality"
317,15,Online Sales Account Manager (Italian)
318,0,Head of Professional Services
319,16,"Solutions Engineer, Google Cloud"
320,5,"Partner Development Manager, Google Cloud"
321,5,"Chrome OEM Channel Sales Manager, Chrome Enterprise and Education"
322,15,"Enterprise Customer Development Representative, Google Cloud"
323,6,"Survey Lead, Google Cloud Support"
324,6,"Associate Account Strategist, Sales, Google Marketing Solutions (Portuguese)"
325,5,"Strategic Partner Manager, Product Partnerships (Geo)"
326,6,"Quality Program Manager, Global Vendor Operations, YouTube"
327,15,"Strategic Agency Consultant, Google Marketing Solutions (Dutch)"
328,15,"Key Account Manager, Large Customer Sales"
329,6,"Data Analyst, Product Trust and Safety"
330,15,"SMB Sales Executive, Google Cloud"
331,15,"Product Analyst, Product and Sales Activation, Google Marketing Solutions"
332,15,"AdMob Technical Sales Lead, Online Partnerships Group"
333,6,"Solutions Consultant, Ads, Google Professional Services"
334,16,"Field Sales Representative, Google Cloud"
335,5,"Partner Business Manager, Google Cloud (Spanish)"
336,6,"Data Insights Analyst, Trust and Safety"
337,15,"Account Manager, Google Cloud Platform"
338,15,"Account Executive, Democratic Elections"
339,15,"Sales Lead, SMB, Google Cloud Platform"
340,16,"Field Sales Representative, Google Cloud"
341,15,"Account Manager, Display, Media Buying Solutions (Spanish)"
342,15,"Account Executive, Mid Market Sales, Google Marketing Solutions"
343,9,MBA Intern (Korean-English Bilingual) 2018
344,16,"Product Specialist, Google Cloud (English)"
345,16,Brand Solution Strategist
346,6,"Associate Account Strategist, Sales, Google Marketing Solutions (French)"
347,15,"Mobile UX Lead, Large Customer Sales (English, Mandarin)"
348,5,"Partner Business Manager, System Integrator Partnerships"
349,15,DoubleClick Search Lead (Full-time/Part-time)
350,16,"Analytical Lead, Pharmaceutical Vertical"
351,15,"Platform Sales Manager, DoubleClick, Media Buying Solutions"
352,16,"Analyst, Partnerships and Trading, Large Customer Sales"
353,15,Online Sales Account Manager (Dutch)
354,15,"Account Executive, Mid-Market, Google Marketing Solutions (English and German)"
355,5,Partner Onboarding Manager (Americas)
356,5,"Partner Specialist, SMB, Google Cloud"
357,5,"Retail Partnerships Manager, Gift Cards, Google Play"
358,15,"Deal Manager, Google Cloud"
359,6,"Business Trainer, Google Cloud"
360,15,"Partner Business Manager (DACH), System Integrator Partnerships (German)"
361,15,"Account Manager, Media Buying Solutions"
362,15,"Account Strategist, Global Partnerships Sales Engine"
363,16,"Field Sales Representative, Google Cloud"
364,15,"Mobile Web Specialist, LCS Central Europe (German)"
365,5,"Strategic Partner Development Manager, Google Marketing Solutions, Channel Sales"
366,15,GMS Sales Agency Lead
367,6,"Solutions Consultant, Ads, Google Professional Services"
368,15,"Field Sales Representative, Google Cloud (DACH)"
369,15,"Associate Account Strategist (Russian), Global Customer Experience"
370,5,"Business Development Manager, Next Billion Users"
371,15,"Associate Account Strategist, Global Customer Experience (Ukrainian)"
372,15,"Account Manager, Automotive (Japanese, English)"
373,16,"Research Analyst, Market Insights"
374,6,"Partner Sales Engineer Manager, Google Cloud"
375,16,Performance Specialist (Korean)
376,16,"Research Analyst, Market Insights"
377,15,"Deal Manager, Google Cloud"
378,5,"Partner Sales Manager, Go-to-Market Partnerships, Google Cloud"
379,6,"Quantitative Analyst Lead, Trust and Safety"
380,15,"Account Strategist, Global Partnerships Sales Engine"
381,15,Online Sales Account Manager (Czech or Slovak)
382,6,"Business Trainer, Google Cloud"
383,15,"Account Executive (Direct), United Kingdom/Ireland"
384,15,"Agency Lead, Traditional Media Agency, GMS"
385,15,"Growth Manager, US Gaming, Mobile Apps"
386,15,"Partner Business Manager (DACH), System Integrator Partnerships (German)"
387,15,"Manager of Store Operations, Hardware Partnerships"
388,5,"Business Development Manager, Next Billion Users"
389,15,"Business Development Consultant (Spanish), Google Marketing Solutions"
390,15,"Account Manager, DoubleClick (Full-time/Part-time)"
391,15,"Inside Sales Manager North Asia, Google Cloud (English)"
392,15,"Sales Development Manager, Cross-Vertical Team"
393,15,"Strategic Account Sales Manager Central/LatAm, Google Cloud"
394,15,"App Specialist LCS (CEE), App Developer Sales, EMEA (Multiple Languages)"
395,5,"Strategic Partner Development Manager, Carriers (English, German)"
396,5,"Partner Support Manager, Android Partner Engineering"
397,15,"Mobile UX Lead, Large Customer Sales (English, Mandarin)"
398,6,"Product Specialist, Google Cloud"
399,16,"Manager of Store Operations, Hardware Partnerships (English and German)"
400,16,"Field Sales Representative, Google Cloud"
401,15,"Account Manager, Retail Vertical"
402,15,"APAC SMB Account Manager, Google Cloud (Mandarin, Cantonese)"
403,16,"Product Specialist, Google Cloud (English)"
404,5,"Partner Training Manager, Android"
405,15,"Business Development Manager, Agency"
406,15,"Deal Manager, Google Cloud"
407,15,Account Manager
408,5,"Partner Development Manager, Google Cloud"
409,15,"Partner Business Manager (DACH), System Integrator Partnerships (German)"
410,15,"Field Sales Representative, Google Cloud (DACH)"
411,15,Analytical Consultant
412,0,"Cloud Consultant, Professional Services, Google Cloud"
413,15,"Enterprise Customer Development Representative, Google Cloud"
414,15,"App Specialist, App Developer Sales (German)"
415,5,"Strategic Partner Manager, Global Partnerships (Hebrew, Russian)"
416,16,"Analytical Lead, Pure Play Retail"
417,6,"Process Specialist, Curated Formats, Google Technical Services"
418,15,"Account Manager, Google Cloud Platform"
419,15,"Sales Development Manager, Cross-Vertical Team"
420,15,"Associate Account Strategist, Global Customer Services (French)"
421,5,"Online Partner Manager (MENA), YouTube"
422,15,"Analytical Consultant, Finance (Hebrew)"
423,5,"Account Manager, Online Partnerships Group (Thai)"
424,5,"Channel Manager, Hardware Partnerships"
425,15,"Field Sales Representative, Google Cloud"
426,15,"Managing Editor, Google Technical Services, Ads, Scaled Engagement and Learning"
427,15,"SMB Sales Manager, North America, Google Cloud"
428,15,"Account Manager, DoubleClick (Full-time/Part-time)"
429,15,"Field Sales Representative, Google Cloud (DACH)"
430,5,"Global Partnerships Solutions Manager, Telecom"
431,6,"Enterprise Customer Development Representative, Google Cloud (Southeast Asian Language)"
432,15,"Strategic Agency Consultant (MENA), Google Marketing Solutions"
433,5,"Business Development Manager, OEM Partnerships, Google Cloud"
434,16,"Solutions Engineer, Google Cloud"
435,15,"Partner Business Manager (DACH), System Integrator Partnerships (German)"
436,15,"Enterprise Customer Development Representative, Google Cloud (Nordics)"
437,15,"Strategic Agency Consultant (Switzerland, Austria), Google Marketing Solutions"
438,6,"Data Analyst, Trust and Safety"
439,15,"Field Sales Representative, Google Cloud"
440,15,"Account Strategist (English, Portuguese)"
441,5,"Partner Development Manager, Google Cloud"
442,6,"Enterprise Customer Development Representative, Google Cloud (Japanese)"
443,12,"Linguist, Natural Language Understanding, Machine Intelligence"
444,16,"Measurement and Attribution Specialist (English, German)"
