,Category,Title
445,15,Sales Development Manager (SDM)
446,15,"Field Sales Manager, Google Cloud"
447,15,"Mobile Sites UX and Conversion Specialist (German), Performance Team"
448,15,"Sales Executive, Google Cloud Platform"
449,15,"Account Manager, Channel Sales"
450,15,Online Sales Account Strategist (Italian)
451,15,"Sales Associate, Large Customer Sales"
452,15,"Associate Account Strategist (Polish), Google Marketing Solutions Sales"
453,15,"Business Development Consultant, Google Marketing Solutions (Italian)"
454,5,"Publisher Intelligence Analyst, Online Partnerships Group"
455,15,GMS Sales Agency Lead
456,5,"Partner Sales Manager, Go-to-Market Partnerships, Google Cloud"
457,15,"Analytical Lead, Home and Personal Care Vertical"
458,16,"Data Analyst, SMB Sales Growth Programs, Google Cloud"
459,15,"Inside Sales Executive, Google Cloud"
460,6,"Sales Engineering Manager, Shared Services, Google Cloud"
461,5,"Partner Strategy Planning Lead, Google Cloud"
462,5,"Strategic Partner Development Manager, New Ads Business Development"
463,15,"Mobile UX Specialist, Large Customer Sales (English, Japanese)"
464,15,"Manager, Mid Market Sales"
465,5,"Partner Operations Manager, Commerce, Google Technical Services"
466,9,"Product Strategist, Growth, YouTube"
467,6,"Associate Account Strategist, Sales, Google Marketing Solutions (Spanish)"
468,15,"Account Manager, Google Cloud Platform"
469,5,"Strategic Partner Development Manager, New Ads Business Development"
470,15,"Platforms Industry Manager, DoubleClick and Google Analytics 360"
471,5,"Global Partnerships Solutions Manager, Telecom"
472,15,"Account Executive, Waze"
473,16,"Measurement and Attribution Specialist (English, German)"
474,15,"Field Sales Representative, Google Cloud"
475,15,"Analytical Lead, Media and Entertainment Vertical"
476,15,"Mobile Web Specialist, LCS Central Europe (German)"
477,5,"Global Partnerships Solutions Lead, News and Publishing"
478,15,"Sales and Customer Growth Strategist, Google Cloud (Spanish)"
479,15,"Field Sales Representative, Google Cloud"
480,15,"Account Executive, Programmatic (Spanish)"
481,16,"Deal Manager, Google Cloud"
482,5,"Strategic Partner Manager (Technical), Channel Sales"
483,15,"Account Executive, Waze (Spanish)"
484,13,"Technical Analytics Architect, Google Cloud Online Experience"
485,15,"Google Analytics Solutions, Specialist (Korean)"
486,15,"Deal Manager, Google Cloud"
487,5,"Global Technical Alliance Manager, Strategic Consultative Partnerships"
488,5,"Partner Development Manager, Online Partnerships Group (English, Mandarin)"
489,6,"Quantitative Analyst, Trust and Safety"
490,17,"Google Cloud Customer Engineer Manager, Financial Services"
491,16,"Field Sales Representative, Google Cloud"
492,15,Search Specialist (Swedish)
493,16,"Product Specialist, Google Cloud (English)"
494,15,"Sales Lead, SMB, Google Cloud Platform"
495,16,"Product Specialist, Google Cloud (English)"
496,15,"Account Executive, Google Cloud"
497,15,"Field Sales Representative, Google Cloud"
498,15,"Partner Business Manager (DACH), System Integrator Partnerships (German)"
499,15,"Head of South East Asia Inside Sales, Google Cloud (English)"
500,5,"Partner Business Manager, System Integrator Partnerships"
501,15,"Deal Lead, Japan (English, Japanese)"
502,6,"Business Trainer, Google Cloud"
503,15,Brand Specialist (Fixed-Term Employee)
504,5,"Partner Development Manager, Google Cloud"
505,16,"Field Sales Representative, Google Cloud"
506,15,"Account Manager, Large Customer Sales"
507,15,Online Sales Account Manager (Spanish)
508,15,"Strategic Cloud DevOps and Infrastructure Engineer, Google Cloud Professional Services"
509,6,"Enterprise Customer Development Representative, Google Cloud (English, Mandarin, Cantonese)"
510,6,"Program Manager, Cloud Platform Sales Development, Google Cloud"
511,0,Store Operations Associate
512,15,"Account Manager, Retail Vertical"
513,6,"Associate Account Strategist, Global Customer Experience (Spanish)"
514,6,"Enforcement Analyst, Trust and Safety, YouTube"
515,15,"Industry Manager, Telecom (English and Russian speaking)"
516,15,"Field Sales Representative, Google Cloud (DACH)"
517,5,"Associate Partnership Manager, Hardware Partnerships (Part-time/Full-time)"
518,15,"Account Strategist, Google Marketing Solutions Sales (Portuguese)"
519,5,Partner Onboarding Manager (Americas)
520,15,"Account Manager, Media, Large Customer Sales (UKI)"
521,15,"Inside Sales and Customer Growth Representative, Google Cloud (English, Mandarin, Cantonese)"
522,15,"Programmatic Industry Manager (English, Bahasa Indonesia)"
523,15,"Market Lead, Google Marketing Solutions (Lithuanian, Latvian or Estonian)"
524,6,"Product Specialist, Google Cloud"
525,15,"Sales Manager, Gaming, Mobile Apps"
526,15,"Online Sales Account Manager, Large Customer Sales (Norwegian, Danish, Swedish)"
527,5,"Global Partnerships Solutions Manager, Telecom"
528,5,"Partner Development Manager, Google Cloud"
529,15,"Field Sales Representative, Google Cloud"
530,16,"Measurement and Attribution Specialist (English, German)"
531,16,"Solutions Engineer, Google Cloud"
532,15,"Inside Sales Manager Japan, Google Cloud"
533,18,"Head of Government Channels, Google Cloud"
534,15,"Platform Sales Manager, Media Platforms Account Lead"
535,15,"Industry Manager, Branding (English, Russian)"
536,5,"Partner Sales Manager, Go-to-Market Partnerships, Google Cloud"
537,5,"Business Development Manager, Google Cloud Partnerships"
538,15,"Enterprise Customer Development Representative, Google Cloud (French)"
539,15,"Account Manager, Mobile App Sales (Vietnamese, English)"
540,16,"Field Sales Representative, Google Cloud (English, Dutch, French)"
541,15,"Deal Manager, Google Cloud"
542,15,"Head of India Inside Sales, Google Cloud"
543,15,"Field Sales Representative, Google Cloud (DACH)"
544,15,"Business Development Manager, Rich Communications Services (RCS)"
545,6,"Partner Support Manager, Chromebook, Platforms and Ecosystems"
546,15,"Political Advertising Program, Summer-Fall 2018"
547,16,"Field Sales Representative, Google Cloud"
548,6,"Community Manager, Social/Communications, Hardware"
549,15,"Strategic Partner Manager (Nordics), Online Partnerships Group"
550,5,"Manager of Store Operations, Hardware Partnerships"
551,15,"Account Manager, DoubleClick (Mandarin)"
552,5,"Strategic Partner Manager, Global Partnerships (Hebrew, Russian)"
553,15,Platforms Account Manager
554,5,"Mobile Apps Technical Specialist, Online Partnership Group (English and Vietnamese or Hindi)"
555,15,"Field Sales Manager, Google Cloud"
556,15,"Sales Manager (DACH), Google Cloud"
557,15,"Inside Sales Manager, Google Cloud"
558,15,"Head of Inside Sales, Google Cloud (English)"
559,15,"Sales Engineer, Google Cloud"
560,16,"Inside Sales Representative, Google Cloud"
561,15,"Account Strategist, Global Partnerships Sales Engine"
562,15,"Platform Sales Manager, Media Platforms Account Lead"
563,15,"Head of Channel Sales, Russia and CIS"
564,6,"Associate Account Strategist, GMS Sales and Services, University Graduate"
565,6,"Associate Account Strategist (Romanian), Google Marketing Solutions Sales"
566,6,"Sales Engineering Manager, Shared Services, Google Cloud"
567,0,"Head of Professional Services (English, French)"
568,16,"Field Sales Representative, Google Cloud"
569,6,"Vendor Strategy Manager, Google Technical Services"
570,15,Account Manager
571,15,"Mobile Web Specialist, LCS Central Europe (German)"
572,15,"Field Sales Representative, Google Cloud"
573,15,"Enterprise Customer Development Representative, Google Cloud (Italian)"
574,15,Head of Creative Agencies
575,5,"Inside Sales and Customer Growth Representative, Google Cloud"
576,15,"Account Manager, Branding"
577,6,"Enterprise Customer Development Representative, Google Cloud (English, Korean)"
578,16,"Data Science Analyst, Revenue Strategy and Operations, Google Marketing Solutions"
579,6,"Associate Account Strategist, Global Customer Experience (Italian)"
580,5,"Partner Specialist, SMB, Google Cloud"
581,15,"Strategic Partner Manager, Carrier"
582,15,Account Strategist (Hebrew)
583,5,"Partner Sales Manager, Go-to-Market Partnerships, Google Cloud"
584,15,"Shopping Specialist, Large Customer Sales (English, Mandarin)"
585,15,"Account Manager, Google Cloud Platform"
586,5,"Android Platform Partnerships Lead, Android and Play Business (French)"
587,15,"Account Manager, Display, Media Buying Solutions (Italian)"
588,15,"Account Manager, App Developer Sales"
589,15,"Cloud Manager (German), Inside Sales"
590,15,"Associate Account Strategist (Czech/Slovak), Sales, Google Marketing Solutions"
591,14,"Technical Solutions Consultant, Android Automotive, Android Partner Engineering"
592,15,"Field Sales Representative, Google Cloud"
593,15,"Field Sales Manager, Google Cloud"
594,15,"Associate Account Strategist (Hungarian), GMS Sales"
595,15,"Analytical Consultant, Auto (English, Russian)"
596,15,Online Sales Account Manager (Portuguese)
597,5,"Partner Growth Lead, Global Technology Partnerships (English, German)"
598,15,"Enterprise Customer Development Representative, Google Cloud (Spanish)"
599,15,"Mobile UX Lead, Large Customer Sales (English, Mandarin)"
600,17,"BOLD Intern, Summer 2018"
601,13,"Product Marketing Manager, YouTube"
602,13,"Program Manager, Web Producer, Google Cloud"
603,13,"Social Marketing Manager, Google Social Lab"
604,13,"Product Specialist, New Hardware Devices and Platforms, Google Play"
605,13,"Partner Marketing Manager, Google Cloud"
606,13,"Operations Manager, International and COO Communications, Google Cloud"
607,13,Business Intern 2018
608,13,"Live Show Producer, Events and Experiences"
609,13,Business Intern 2018
610,9,"MBA Intern, Summer 2018"
611,13,"Head of Field Marketing (North Asia), Google Cloud"
612,13,Business Intern 2018
613,13,"Communications Manager, Ads and Commerce"
614,13,"Product Marketing Manager, IoT, Google Cloud Platform"
615,13,Business Intern 2018
616,13,"Merchandising Manager, Games, Google Play (English, Russian)"
617,13,Business Intern 2018
618,19,MBA Intern 2018
619,13,"Product Marketing Manager, Google Play, Japan (English, Japanese)"
620,17,"BOLD Intern, Summer 2018"
621,13,"Industry Public Relations Manager, Google Cloud"
622,13,"Partner Public Relations Manager, Google Cloud"
623,13,"Communications Manager, Developer and Emerging Ads"
624,13,"Product Marketing Manager, IoT, Google Cloud Platform"
625,13,"Product Manager, Growth, Waze"
626,13,"Associate Product Marketing Manager Program (APMM), Japan Hardware Marketing"
627,13,"Internal Communications Manager, Ads and Commerce"
628,13,"Global Campaigns Manager, Google Cloud (Apigee)"
629,13,"Content Strategist, Consumers, Google Technical Services"
630,13,"Customer Growth Marketing Manager, Google Cloud"
631,9,MBA Intern (Korean-English Bilingual) 2018
632,13,"Product Marketing Manager, Databases, Google Cloud"
633,13,Communications Manager (Full-time/Part-time)
634,19,MBA Intern 2018
635,13,"Central Strategy and Operations Lead, Cloud Marketing"
636,9,"MBA Intern, Summer 2018"
637,13,Business Intern 2018
638,13,Media Research Manager (English and Turkish speaker)
639,13,"SEO Strategist, Online Experience, Google Cloud"
640,13,Business Intern 2018
641,13,"Americas Books Merchandising Manager, Google Play"
642,13,Internal Executive Communications and Event Producer
643,13,"Consumer Product Marketing Manager, YouTube"
644,9,"MBA Intern, Summer 2018"
645,9,"MBA Intern, Summer 2018"
646,13,"Visual Designer, Brand Studio"
647,13,Digital Marketing Strategist (German)
648,13,"Field Marketing Manager, Apigee"
649,13,"Head of Internal Communications, Distribution and Go-to-Market, Google Cloud"
650,13,"Research Analyst, Market Insights"
651,13,"Customer Public Relations Manager, Google Cloud"
652,13,"Product Marketing Manager, Google Cloud Platform Monitoring, Google Cloud"
653,17,"BOLD Intern, Summer 2018"
654,13,"Product Marketing Manager, Direct SMB Acquisitions"
655,13,"Global Head of Music Social and Influencer Marketing, Marketing, YouTube"
656,13,"Communications Analyst, Physical Security"
657,13,"Product Marketing Manager, Apigee Google Cloud Platform"
658,13,Business Intern 2018
659,13,Business Intern 2018
660,13,Business Intern 2018
661,17,"Business Intern 2018, Mexico"
662,13,"Product Marketing Manager, Growth, Hire Team"
663,17,"Business Intern 2018, Colombia"
664,13,Business Intern 2018
665,9,"Global Head of Strategy and Operations, Brand Studio"
666,13,Business Intern 2018
667,13,Business Intern 2018
668,17,"BOLD Intern, Summer 2018"
669,13,"Business Intern 2017, Australia"
670,13,"Brand and Creative Strategist, Brand Studio (APAC)"
671,13,Head of BrandLab
672,13,"Manager, Corporate Communications, Google Cloud"
673,13,"Manager, Corporate Communications, Google Cloud"
674,13,"Developer Product Marketing Manager, Google Play"
675,19,MBA Intern 2018
676,13,"Customer Reference Marketing Manager, Google Cloud"
677,13,"Global Head of Music Social and Influencer Marketing, Marketing, YouTube"
678,13,Business Intern 2018
679,13,"Director of Go-To-Market Communications, Google Cloud"
680,13,"Partner Marketing Manager, Google Cloud Marketing (Japan)"
681,13,"Marketing Analytics Manager, SMB Marketing"
682,9,"MBA Intern, Summer 2018"
683,13,"Ads Marketing Manager, Latin America, Waze (Spanish)"
684,19,MBA Intern 2018
685,13,"Product Marketing Manager, YouTube Music and Subscriptions"
686,13,"Product Marketing Manager (PMM), SMB Marketing"
687,13,Business Intern 2018
688,13,Business Intern 2018
689,13,"Business Development Consultant, Google Marketing Solutions (Swedish)"
690,13,"Digital Analyst, Google Cloud Online Experience"
691,13,"Communications Manager, Ads and Commerce"
692,17,"BOLD Intern, Summer 2018"
693,19,MBA Intern 2018
694,13,"Communications Manager, Developer and Emerging Ads"
695,13,"Industry Public Relations Manager, Google Cloud"
696,13,Communications Manager (Full-time/Part-time)
697,13,"Communications and Programs Manager, Google Technical Services"
698,13,"Product Marketing Manager, CRM, Google Store"
699,13,"Global Lead, Industry Solutions, Health and Life Sciences Marketing, Google Cloud"
700,13,"Head of Creative, Retail Marketing"
701,13,Business Intern 2018
702,13,"Product Marketing Manager, Digital Skills for Economic Impact"
703,13,Business Intern 2018
704,17,"BOLD Intern, Summer 2018"
705,13,"Partner Marketing Manager, Retail"
706,13,"Retail Strategy Lead, Retail Marketing"
707,13,"Director of Go-To-Market Communications, Google Cloud"
708,13,"Program Manager/Producer, Global Hardware Marketing"
709,13,Business Intern 2018
710,13,"Associate Account Strategist, Sales, Google Marketing Solutions (English and Russian)"
711,13,"Technical Analytics Architect, Google Cloud Online Experience"
712,13,"Store Campaigns Manager, Merchandising, Google Play"
713,13,Business Intern 2018
714,13,Business Intern 2018
715,13,Internal Communications Manager
716,13,"Program Manager, Communications, Google Cloud"
717,13,"Creative Lead, Marketing (India)"
718,13,"Head of Field Marketing, Google Cloud (English, German)"
719,17,"BOLD Intern, Summer 2018"
720,13,"Customer Public Relations Manager, Google Cloud"
721,13,"Copywriter, Web, Google Cloud"
722,13,"Communications Manager, Ads and Commerce"
723,13,Business Intern 2018
724,13,"Events Manager Lead, Google Cloud Marketing"
725,13,Business Intern 2018
726,17,"Business Intern 2018, Brazil"
727,13,"Communications Manager, Developer and Emerging Ads"
728,13,Media Research Manager
729,13,"Partner Public Relations Manager, Google Cloud"
730,13,"Branding and Video Specialist, Northern Europe"
731,13,Business Intern 2018
732,9,"MBA Intern, Summer 2018"
733,13,"Communications Manager, Search"
734,13,Business Intern 2018
735,13,Product Marketing Manager
736,13,"Marketing Analyst, Product Growth"
737,13,"Interactive Design Manager, Retail Marketing"
738,13,"Visual Designer, Events and Experiences"
739,13,"Internal and Executive Communications Associate, Daydream"
740,13,"Marketing Analytics Manager, Retail Marketing"
741,13,Executive Briefing Manager
742,13,AR and VR Writer
743,13,"Internal Communications Manager, Ads and Commerce"
744,13,Business Intern 2018
745,13,"Creative Technology Lead, Brand Studio (APAC)"
746,13,"Product Marketing Manager, SMB Marketing (Spanish)"
747,13,Business Intern 2018
748,13,Internal Communications Manager
749,13,Public Policy and Government Relations Manager for Southern Cone (English and Spanish speaker)
750,13,"Product Marketing Manager, Networking, Google Cloud"
751,17,Business Intern 2018
752,13,"Global Go-to-Market Strategy Lead, Retail Marketing"
753,9,"MBA Intern, Summer 2018"
754,13,"Product Marketing Manager, Google Analytics"
755,13,Business Intern 2018
756,13,"Product Marketing Manager, Startups, SMB Marketing (English, German)"
757,13,"Product Marketing Manager, Consumer Strategy"
758,13,"Product Marketing Manager, Growth, Hire Team"
759,13,"Demand Generation Marketing Manager, North America Growth Marketing, Google Cloud"
760,19,MBA Intern 2018
761,13,"Head of Communications, EMEA Marketing"
762,13,"Operations Manager, International and COO Communications, Google Cloud"
763,13,"Product Marketing Manager, Windows, Google Cloud Platform"
764,13,Consumer Insights Manager
765,13,"Data Strategist, Online Partnerships Group"
766,13,Business Intern 2018
767,13,"Global Lead, Industry Solutions, Health and Life Sciences Marketing, Google Cloud"
768,9,"Head of Growth Marketing Strategy, Google Play"
769,13,"Policy Advisor, Trust and Safety"
770,13,"Content Policy Manager, Asia Pacific (Full-time/Part-time)"
771,13,"Communications and Programs Manager, Google Technical Services"
772,17,"Business Intern 2018, Argentina"
773,13,Business Intern 2018
774,13,Associate Product Marketing Manager
775,13,"Product Marketing Manager, IoT, Google Cloud Platform"
776,13,"Communications Manager, Search"
777,13,"Channel Partner Marketing Manager, Devices, Google Cloud"
778,13,Business Intern 2018
779,13,Business Intern 2018
780,9,"MBA Intern, Summer 2018"
781,13,"Product Marketing Manager, Google Hardware"
782,13,"Alliances Marketing Manager, Google Cloud"
783,19,MBA Intern 2018
784,20,"Design Producer, Hardware"
785,20,"User Experience Design Intern, Summer 2018"
786,20,Interaction Designer
787,20,User Experience Researcher
788,20,"User Experience Research Intern, Summer 2018"
789,20,"User Experience Design Intern, Summer 2018"
790,20,"User Experience Engineer Intern, Summer 2018"
791,20,"User Experience Research Intern, Summer 2018"
792,20,"UX Researcher (English, Mandarin)"
793,20,User Experience Researcher
794,20,"Android UX Engineer, Design"
795,20,Quantitative User Experience Researcher
796,20,User Experience Researcher
797,20,"User Experience Writer Intern, Summer 2018"
798,20,User Experience Researcher
799,20,"User Experience Design Intern, Summer 2018"
800,20,"Industrial Designer, Hardware"
801,20,Interaction Designer
802,20,Interaction Designer
803,20,User Experience Researcher
804,20,"UX Engineer, Front End"
805,20,"UX Engineer, Front End"
806,20,Visual Designer
807,20,User Experience Research Lead
808,20,"Android UX Engineer, Front End, Waze"
809,20,"User Experience Design Intern, Mid-Year 2018"
810,20,"Industrial Design Intern, Summer 2018"
811,20,Interaction Designer
812,20,User Experience Researcher
813,20,UX Content Strategist Lead
814,20,"User Experience Design Intern, Summer 2018"
815,20,Visual Designer
816,20,"UX Engineer, Front End, Waze"
817,20,"User Experience Design Intern, Summer 2018"
818,20,"User Experience Design Intern, Summer 2018"
819,20,Voice User Interface Designer
820,20,"User Experience Writer Intern, Summer 2018"
821,20,User Experience Researcher
822,20,"Interaction Designer, Google Photos"
823,20,Interaction Designer
824,20,"User Experience Engineer Intern, Summer 2018"
825,20,"User Experience Research Intern, Summer 2018"
826,20,UX Design Manager
827,20,UX Writer
828,20,"User Experience Research Intern, Summer 2018"
829,20,"User Experience Engineer Intern, Summer 2018"
830,20,"User Experience Research Intern, Summer 2018"
831,12,"Linguist, Natural Language Understanding, Machine Intelligence"
832,20,"User Experience Researcher, Google Cloud Support"
833,20,UX Writer
834,20,User Experience Research Lead
835,20,"Regional Lead (APAC), Google Assistant Personality, Doodle Team"
836,20,UX Content Strategist
837,20,UX Design Manager
838,20,Voice User Interface Designer
839,20,UX Design Manager
840,20,Interaction Designer
841,20,UX Design Manager
842,20,Quantitative User Experience Researcher
843,20,Hardware Interaction Designer
844,20,Visual Designer
845,20,Interaction Designer
846,20,Interaction Designer
847,20,Quantitative User Experience Research Lead
848,20,"User Experience Engineer Intern, Summer 2018"
849,20,User Experience Research Lead
850,20,Visual Designer
851,20,User Experience Researcher
852,20,UX Design Lead
853,20,"User Experience Design Intern, Summer 2018"
854,20,"UX Engineer, Design (Android or iOS)"
855,20,Interaction Designer
856,20,"Interaction Designer, YouTube"
857,20,Interaction Designer
858,20,Interaction Designer
859,20,User Experience Researcher
860,20,Quantitative User Experience Researcher
861,20,UX Program Manager
862,20,Interaction Designer
863,20,"Interaction Designer, Publisher UX"
864,20,"Interaction Designer, Site Reliability - London"
865,20,"User Experience Researcher, Play"
866,20,"User Experience Research Intern, Summer 2018"
867,20,Visual Designer
868,20,UX Design Manager
869,9,"Operations Manager, Global Partnerships"
870,9,"MBA Intern, Summer 2018"
871,9,"Curriculum Architect Manager, Scaled Engagement and Learning, Google Technical Services"
872,19,MBA Intern 2018
873,9,"Strategy and Business Analyst, Go-to-Market, Google Marketing Solutions"
874,9,"Chief of Staff, Google Hardware"
875,9,Lead Data Scientist
876,9,MBA Intern (Korean-English Bilingual) 2018
877,9,"Product Analyst, Data Science"
878,19,MBA Intern 2018
879,9,"MBA Intern, Summer 2018"
880,9,"MBA Intern, Summer 2018"
881,9,"MBA Intern, Summer 2018"
882,9,"Business Operations Lead, Google Play"
883,9,"Consumer Operations Product Support Manager, (Multiple Products)"
884,9,"Business Intern, Veteran"
885,9,"Product Analyst, Data Science"
886,9,"Product Analytics Lead, Data Science"
887,9,"Business Strategy Lead, Phones Business"
888,9,"Head of Business Development, Strategic Partnerships, Google Cloud"
889,9,"Strategy and Operations Manager, Consumer Hardware Products"
890,9,"Global Head of Strategy and Operations, Brand Studio"
891,9,"SMB Sales Manager, International, Google Cloud"
892,9,Global Business Strategy Manager
893,9,"Product Analyst, Data Science"
894,9,"Project Manager (EMEA), Customer Experience, Go-to-Market"
895,19,MBA Intern 2018
896,9,"Global Business Strategy Manager, Sales Productivity, Central Strategy and Operations"
897,9,"Scaled Abuse Analyst, YouTube"
898,9,"Partner Strategy Planning Lead, Google Cloud"
899,9,"Business Systems Analyst, PLM and CAD"
900,9,"Lead Product Analyst, Data Science"
901,9,"MBA Intern, Summer 2018"
902,19,MBA Intern 2018
903,9,"Global Business Strategy Manager, Sales Productivity, Central Strategy and Operations"
904,9,Network Business Analyst
905,9,"Strategy and Operations Manager, Go-To-Market, Partnerships"
906,9,"Business Analyst, Google Play Partner Promotions Strategy"
907,9,"Head of Go-To-Market, Brazil"
908,19,MBA Intern 2018
909,9,"Data Scientist / Quantitative Analyst Technical Lead, Engineering"
910,9,"Head of Platforms and Display, Go-to-Market Strategy and Operations"
911,9,"Business Strategy Lead, Phone Accessories (Google Hardware)"
912,9,"Product Strategist, Growth, YouTube"
913,9,"Strategy Associate, Search and Assistant Distribution, Global Partnerships"
914,9,"Agency Go-to-Market and Business Analytics Manager, Spanish Speaking LatAm"
915,9,"Enterprise Customer Development Representative, Google Cloud (German)"
916,9,Strategy and Insights Associate/Manager
917,9,"Go-To-Market Strategy Manager (EMEA), Pixel"
918,9,"Strategy and Operations Analyst, Ad Grants"
919,9,"Principal, Strategy, YouTube"
920,9,"Go-to-Market Specialist, Google Cloud"
921,9,"MBA Intern, Summer 2018"
922,9,Risk and Compliance Manager
923,9,"Business Analyst Intern, Summer 2018"
924,9,Android Device Strategy Lead
925,9,"Market Intelligence Analyst, Consumer Hardware Products"
926,9,"Business Analyst, Strategic Relationships, Japan"
927,9,"User Engagement Strategy Manager, Google Technical Services, Scaled Engagement and Learning"
928,9,"Associate, Business Operations and Strategy"
929,9,"Strategy and Operations Excellence Analyst, Google Marketing Solutions"
930,9,"Go-to-Market Lead, Southeast Asia/India Partnerships"
931,9,"MBA Intern, Summer 2018"
932,9,"Product Analyst, Data Science"
933,9,"Data Scientist / Quantitative Analyst Technical Lead, Engineering"
934,19,MBA Intern 2018
935,9,"Business Systems Analyst, Financial Applications"
936,9,"Head of Growth Marketing Strategy, Google Play"
937,9,"Go-to-Market Specialist, Google Cloud"
938,9,"MBA Intern, Summer 2018"
939,9,"Product Analytics Lead, Data Science"
940,19,MBA Intern 2018
941,17,"BOLD Intern, Summer 2018"
942,17,Accountant
943,17,"Internal Audit, Technology Auditor"
944,17,"Senior Technology Auditor, Internal Audit"
945,17,Brand and Reputation Strategy Lead
946,17,"Payroll Operations Controller, Financial Operations (English, Portuguese)"
947,17,"Risk Advisor, YouTube"
948,9,"MBA Intern, Summer 2018"
949,17,"Inventory Accounting Manager, Consumer Hardware"
950,19,MBA Intern 2018
951,17,"BOLD Intern, Summer 2018"
952,17,"APAC Accounting Lead, Non-Ads Products"
953,9,MBA Intern (Korean-English Bilingual) 2018
954,17,Strategic Vendor Manager
955,19,MBA Intern 2018
956,17,"Business Intelligence and Analytics Manager, Finance"
957,9,"MBA Intern, Summer 2018"
958,17,Supply Chain Procurement Operations Manager
959,9,"MBA Intern, Summer 2018"
960,9,"MBA Intern, Summer 2018"
961,17,"Senior Tax Manager, Treasury"
962,17,"Finance Manager, Pixel"
